<?xml version="1.0" encoding="UTF-8" ?>

<tree xmlns:xsi="http://www.w3.org/2001/XMLSchema-instance"
      xsi:noNamespaceSchemaLocation="../../TCP.xsd">
<node xsi:type="constructor" type="AND">
<left xsi:type="basicService" identifier="195">
<quadruple>
<d1>3</d1>
<c1>110</c1>
<d2>5</d2>
<c2>46</c2>
</quadruple>
<quadruple>
<d1>5</d1>
<c1>79</c1>
<d2>18</d2>
<c2>106</c2>
</quadruple>
<quadruple>
<d1>18</d1>
<c1>135</c1>
<d2>31</d2>
<c2>151</c2>
</quadruple>
<quadruple>
<d1>31</d1>
<c1>73</c1>
<d2>42</d2>
<c2>14</c2>
</quadruple>
<quadruple>
<d1>42</d1>
<c1>63</c1>
<d2>53</d2>
<c2>126</c2>
</quadruple>
<quadruple>
<d1>53</d1>
<c1>56</c1>
<d2>61</d2>
<c2>81</c2>
</quadruple>
<quadruple>
<d1>61</d1>
<c1>142</c1>
<d2>74</d2>
<c2>47</c2>
</quadruple>
<quadruple>
<d1>74</d1>
<c1>143</c1>
<d2>75</d2>
<c2>152</c2>
</quadruple>
<quadruple>
<d1>75</d1>
<c1>26</c1>
<d2>87</d2>
<c2>21</c2>
</quadruple>
<quadruple>
<d1>87</d1>
<c1>13</c1>
<d2>152</d2>
<c2>4</c2>
</quadruple>
</left>
<right xsi:type="basicService" identifier="196">
<quadruple>
<d1>3</d1>
<c1>109</c1>
<d2>12</d2>
<c2>88</c2>
</quadruple>
<quadruple>
<d1>12</d1>
<c1>90</c1>
<d2>13</d2>
<c2>21</c2>
</quadruple>
<quadruple>
<d1>13</d1>
<c1>151</c1>
<d2>18</d2>
<c2>15</c2>
</quadruple>
<quadruple>
<d1>18</d1>
<c1>86</c1>
<d2>20</d2>
<c2>63</c2>
</quadruple>
<quadruple>
<d1>20</d1>
<c1>55</c1>
<d2>27</d2>
<c2>124</c2>
</quadruple>
<quadruple>
<d1>27</d1>
<c1>21</c1>
<d2>33</d2>
<c2>124</c2>
</quadruple>
<quadruple>
<d1>33</d1>
<c1>64</c1>
<d2>44</d2>
<c2>88</c2>
</quadruple>
<quadruple>
<d1>44</d1>
<c1>39</c1>
<d2>52</d2>
<c2>112</c2>
</quadruple>
<quadruple>
<d1>52</d1>
<c1>15</c1>
<d2>56</d2>
<c2>58</c2>
</quadruple>
<quadruple>
<d1>56</d1>
<c1>124</c1>
<d2>152</d2>
<c2>101</c2>
</quadruple>
</right>
</node>
</tree>